{
  "$schema": "../../schemas/curriculum.schema.json",
  "schema_version": 1,
  "track": "philosophy-and-logic",
  "audit_status": "audited",
  "last_coverage_audit": "2026-08-19",
  "nodes": [
    {
      "id": "PHL-N-0001",
      "title": "What philosophy and logic are actually doing",
      "level": "L0",
      "status": "published",
      "prerequisites": [],
      "outcomes": [
        "Distinguish philosophical inquiry from mere opinion-reporting and explain how claims, reasons, objections, and logical evaluation interact."
      ],
      "target_concepts": [
        {
          "id": "PHL-C-0001",
          "target_depth": "D1"
        }
      ],
      "branch": "core",
      "lesson_id": "PHL-0001"
    },
    {
      "id": "PHL-N-0002",
      "title": "Questions, claims, reasons, and arguments",
      "level": "L0",
      "status": "planned",
      "prerequisites": [
        "PHL-N-0001"
      ],
      "outcomes": [
        "Turn an open question into a candidate claim supported by explicit reasons."
      ],
      "target_concepts": [
        {
          "id": "PHL-C-0002",
          "target_depth": "D1"
        }
      ],
      "branch": "core",
      "lesson_id": null
    },
    {
      "id": "PHL-N-0003",
      "title": "Premises, conclusions, and argument indicators",
      "level": "L0",
      "status": "planned",
      "prerequisites": [
        "PHL-N-0002"
      ],
      "outcomes": [
        "Identify premises and conclusions without mistaking indicator words for infallible rules."
      ],
      "target_concepts": [
        {
          "id": "PHL-C-0003",
          "target_depth": "D1"
        }
      ],
      "branch": "core",
      "lesson_id": null
    },
    {
      "id": "PHL-N-0004",
      "title": "Truth, validity, and soundness",
      "level": "L0",
      "status": "planned",
      "prerequisites": [
        "PHL-N-0003"
      ],
      "outcomes": [
        "Separate whether premises are true from whether a conclusion follows and whether a deductive argument is sound."
      ],
      "target_concepts": [
        {
          "id": "PHL-C-0004",
          "target_depth": "D1"
        }
      ],
      "branch": "core",
      "lesson_id": null
    },
    {
      "id": "PHL-N-0005",
      "title": "Deduction, induction, and abduction",
      "level": "L0",
      "status": "planned",
      "prerequisites": [
        "PHL-N-0004"
      ],
      "outcomes": [
        "Distinguish deductive support from ampliative inductive and abductive reasoning."
      ],
      "target_concepts": [
        {
          "id": "PHL-C-0005",
          "target_depth": "D1"
        }
      ],
      "branch": "core",
      "lesson_id": null
    },
    {
      "id": "PHL-N-0006",
      "title": "Counterexamples and testing universal claims",
      "level": "L0",
      "status": "planned",
      "prerequisites": [
        "PHL-N-0004"
      ],
      "outcomes": [
        "Use a counterexample to refute a universal claim or an invalid inference pattern."
      ],
      "target_concepts": [
        {
          "id": "PHL-C-0006",
          "target_depth": "D1"
        }
      ],
      "branch": "core",
      "lesson_id": null
    },
    {
      "id": "PHL-N-0007",
      "title": "Ambiguity, vagueness, and conceptual distinctions",
      "level": "L0",
      "status": "planned",
      "prerequisites": [
        "PHL-N-0002"
      ],
      "outcomes": [
        "Diagnose ambiguity and vagueness and introduce distinctions that improve a philosophical question."
      ],
      "target_concepts": [
        {
          "id": "PHL-C-0007",
          "target_depth": "D1"
        }
      ],
      "branch": "core",
      "lesson_id": null
    },
    {
      "id": "PHL-N-0008",
      "title": "Definitions and conceptual analysis",
      "level": "L0",
      "status": "planned",
      "prerequisites": [
        "PHL-N-0007"
      ],
      "outcomes": [
        "Compare stipulative, lexical, and analytic uses of definitions without assuming every concept has a simple essence."
      ],
      "target_concepts": [
        {
          "id": "PHL-C-0008",
          "target_depth": "D1"
        }
      ],
      "branch": "core",
      "lesson_id": null
    },
    {
      "id": "PHL-N-0009",
      "title": "Principle of charity and steelmanning",
      "level": "L0",
      "status": "planned",
      "prerequisites": [
        "PHL-N-0003"
      ],
      "outcomes": [
        "Reconstruct a position in a defensible form before criticizing it."
      ],
      "target_concepts": [
        {
          "id": "PHL-C-0009",
          "target_depth": "D1"
        }
      ],
      "branch": "core",
      "lesson_id": null
    },
    {
      "id": "PHL-N-0010",
      "title": "Informal fallacies as failed reasoning patterns",
      "level": "L0",
      "status": "planned",
      "prerequisites": [
        "PHL-N-0005",
        "PHL-N-0009"
      ],
      "outcomes": [
        "Diagnose recurrent reasoning failures by explaining what goes wrong rather than matching labels mechanically."
      ],
      "target_concepts": [
        {
          "id": "PHL-C-0010",
          "target_depth": "D1"
        }
      ],
      "branch": "core",
      "lesson_id": null
    },
    {
      "id": "PHL-N-0011",
      "title": "Reading philosophy: thesis, argument, objection, reply",
      "level": "L0",
      "status": "planned",
      "prerequisites": [
        "PHL-N-0003",
        "PHL-N-0009"
      ],
      "outcomes": [
        "Annotate a short philosophical passage into thesis, support, objection, and response."
      ],
      "target_concepts": [
        {
          "id": "PHL-C-0011",
          "target_depth": "D1"
        }
      ],
      "branch": "core",
      "lesson_id": null
    },
    {
      "id": "PHL-N-0012",
      "title": "Writing philosophy: claim, reason, objection, response",
      "level": "L0",
      "status": "planned",
      "prerequisites": [
        "PHL-N-0011"
      ],
      "outcomes": [
        "Write a compact philosophical paragraph that states a claim, supports it, faces an objection, and responds."
      ],
      "target_concepts": [
        {
          "id": "PHL-C-0012",
          "target_depth": "D1"
        }
      ],
      "branch": "core",
      "lesson_id": null
    },
    {
      "id": "PHL-N-0013",
      "title": "What formalization gains and loses",
      "level": "L0",
      "status": "planned",
      "prerequisites": [
        "PHL-N-0004",
        "PHL-N-0007"
      ],
      "outcomes": [
        "Explain why formalization can expose structure while also abstracting away context and meaning."
      ],
      "target_concepts": [
        {
          "id": "PHL-C-0013",
          "target_depth": "D1"
        }
      ],
      "branch": "core",
      "lesson_id": null
    },
    {
      "id": "PHL-N-0014",
      "title": "Propositions and truth-functional structure",
      "level": "L0",
      "status": "planned",
      "prerequisites": [
        "PHL-N-0013"
      ],
      "outcomes": [
        "Recognize propositions as truth-evaluable contents and identify simple truth-functional structure."
      ],
      "target_concepts": [
        {
          "id": "PHL-C-0014",
          "target_depth": "D1"
        }
      ],
      "branch": "core",
      "lesson_id": null
    },
    {
      "id": "PHL-N-0015",
      "title": "Negation, conjunction, disjunction, and conditional",
      "level": "L0",
      "status": "planned",
      "prerequisites": [
        "PHL-N-0014"
      ],
      "outcomes": [
        "Read the core propositional connectives in ordinary language and symbolic form."
      ],
      "target_concepts": [
        {
          "id": "PHL-C-0015",
          "target_depth": "D1"
        }
      ],
      "branch": "core",
      "lesson_id": null
    },
    {
      "id": "PHL-N-0016",
      "title": "Truth tables and semantic evaluation",
      "level": "L0",
      "status": "planned",
      "prerequisites": [
        "PHL-N-0015"
      ],
      "outcomes": [
        "Evaluate simple truth-functional expressions with truth tables."
      ],
      "target_concepts": [
        {
          "id": "PHL-C-0016",
          "target_depth": "D1"
        }
      ],
      "branch": "core",
      "lesson_id": null
    },
    {
      "id": "PHL-N-0017",
      "title": "Predicates and quantifiers: first intuition",
      "level": "L0",
      "status": "planned",
      "prerequisites": [
        "PHL-N-0014"
      ],
      "outcomes": [
        "Distinguish names, predicates, and quantifier-like expressions before formal predicate logic."
      ],
      "target_concepts": [
        {
          "id": "PHL-C-0017",
          "target_depth": "D1"
        }
      ],
      "branch": "core",
      "lesson_id": null
    },
    {
      "id": "PHL-N-0018",
      "title": "A map of philosophy: knowledge, reality, value, mind, language, science, and society",
      "level": "L0",
      "status": "planned",
      "prerequisites": [
        "PHL-N-0002"
      ],
      "outcomes": [
        "Place a philosophical question into major fields while recognizing that real problems cross field boundaries."
      ],
      "target_concepts": [
        {
          "id": "PHL-C-0018",
          "target_depth": "D1"
        }
      ],
      "branch": "core",
      "lesson_id": null
    },
    {
      "id": "PHL-N-0019",
      "title": "Propositional-logic syntax and well-formed formulas",
      "level": "L1",
      "status": "planned",
      "prerequisites": [
        "PHL-N-0015"
      ],
      "outcomes": [
        "Parse and construct well-formed propositional formulas."
      ],
      "target_concepts": [
        {
          "id": "PHL-C-0019",
          "target_depth": "D1"
        }
      ],
      "branch": "core",
      "lesson_id": null
    },
    {
      "id": "PHL-N-0020",
      "title": "Propositional semantics and valuations",
      "level": "L1",
      "status": "planned",
      "prerequisites": [
        "PHL-N-0016",